<?xml version="1.0" encoding="UTF-8"?>
<MetronInfo xmlns:xsi="http://www.w3.org/2001/XMLSchema-instance" xsi:noNamespaceSchemaLocation="MetronInfo.xsd">
    <ID>
        <Primary source="Metron">290431</Primary>
        <Alternative source="Comic Vine">12345</Alternative>
        <Alternative source="Grand Comics Database">543</Alternative>
    </ID>
    <Publisher id="12345">
        <Name>DC Comics</Name>
        <Imprint id="1234">Vertigo</Imprint>
    </Publisher>
    <Series id="65478" lang="en">
        <Name>Justice League</Name>
        <SortName>Justice League</SortName>
        <Volume>2</Volume>
        <Format>Single Issue</Format>
        <AlternativeNames>
            <Name id="1234">Foo</Name>
            <Name lang="de">Hüsker Dü</Name>
        </AlternativeNames>
    </Series>
    <Number>1</Number>
    <Stories>
        <Story id="12">Justice League, Part One</Story>
        <Story>Justice League, Part Two</Story>
    </Stories>
    <Summary>In a universe where super heroes are strange and new, Batman has discovered a dark evil that requires him to unite the World Greatest Heroes!</Summary>
    <Notes>Nothing really to say.</Notes>
    <Prices>
        <Price country="US">3.99</Price>
        <Price country="GB">1.51</Price>
    </Prices>
    <CoverDate>2011-10-01</CoverDate>
    <StoreDate>2011-08-31</StoreDate>
    <PageCount>32</PageCount>
    <Genres>
        <Genre id="98745">Super-Hero</Genre>
        <Genre>Crime</Genre>
    </Genres>
    <Tags>
        <Tag id="78945">Foo</Tag>
        <Tag>Bar</Tag>
    </Tags>
    <Arcs>
        <Arc id="78945">
            <Name>Origin</Name>
            <Number>1</Number>
        </Arc>
        <Arc>
            <Name>The New 52!</Name>
        </Arc>
    </Arcs>
    <Characters>
        <Character id="45678">Aquaman</Character>
        <Character>Batman</Character>
        <Character>Cyborg</Character>
        <Character>Deadman</Character>
        <Character>Barry Allen</Character>
        <Character>Hal Jordan</Character>
        <Character>Hawkman</Character>
        <Character>Mera</Character>
        <Character>Pandora</Character>
        <Character>Ray Palmer</Character>
        <Character>Superman</Character>
        <Character>Wonder Woman</Character>
    </Characters>
    <Teams>
        <Team id="49948">Justice League</Team>
        <Team>Parademons</Team>
    </Teams>
    <Universes>
        <Universe id="24">
            <Name>ABC</Name>
            <Designation>Earth 25</Designation>
        </Universe>
        <Universe>
            <Name>Amalgam</Name>
        </Universe>
    </Universes>
    <Locations>
        <Location id="12389">Gotham City</Location>
        <Location>Metropolis</Location>
    </Locations>
    <GTIN>
        <ISBN>1234567890123</ISBN>
        <UPC>76194130593600111</UPC>
    </GTIN>
    <AgeRating>Everyone</AgeRating>
    <Reprints>
        <Reprint id="65498">Foo Bar #001 (2002)</Reprint>
        <Reprint>Foo Bar #002 (2022)</Reprint>
    </Reprints>
    <URL>
        <Primary>https://comicvine.gamespot.com/justice-league-1-justice-league-part-one/4000-290431/</Primary>
        <Alternative>https://foo.bar</Alternative>
    </URL>
    <Credits>
        <Credit>
            <Creator id="32165">Geoff Johns</Creator>
            <Roles>
                <Role id="32165">Writer</Role>
            </Roles>
        </Credit>
        <Credit>
            <Creator>David Finch</Creator>
            <Roles>
                <Role>Cover</Role>
            </Roles>
        </Credit>
        <Credit>
            <Creator>Richard Friend</Creator>
            <Roles>
                <Role>Cover</Role>
            </Roles>
        </Credit>
        <Credit>
            <Creator>Jim Lee</Creator>
            <Roles>
                <Role>Penciller</Role>
                <Role>Cover</Role>
            </Roles>
        </Credit>
        <Credit>
            <Creator>Scott Williams</Creator>
            <Roles>
                <Role>Inker</Role>
                <Role>Cover</Role>
            </Roles>
        </Credit>
        <Credit>
            <Creator>Alex Sinclair</Creator>
            <Roles>
                <Role>Colorist</Role>
                <Role>Cover</Role>
            </Roles>
        </Credit>
        <Credit>
            <Creator>Pat Brosseau</Creator>
            <Roles>
                <Role>Letterer</Role>
            </Roles>
        </Credit>
        <Credit>
            <Creator>Rex Ogle</Creator>
            <Roles>
                <Role>Associate Editor</Role>
            </Roles>
        </Credit>
        <Credit>
            <Creator>Eddie Berganza</Creator>
            <Roles>
                <Role>Editor</Role>
            </Roles>
        </Credit>
        <Credit>
            <Creator>Dan DiDio</Creator>
            <Roles>
                <Role>Publisher</Role>
            </Roles>
        </Credit>
    </Credits>
    <LastModified>2023-05-31T09:00:46.300882-04:00</LastModified>
    <Pages>
        <Page index="0" type="FrontCover" size="1733120" height="2951" width="1920" />
        <Page index="1" size="1320938" height="2951" width="1920" double_page="true" />
        <Page index="2" size="1298224" height="2951" width="1920" />
        <Page index="3" size="1587983" height="2951" width="1920" />
        <Page index="4" size="1840640" height="2951" width="1920" />
        <Page index="5" size="1759923" height="2951" width="1920" />
        <Page index="6" size="1719108" height="2951" width="1920" />
        <Page index="7" size="1776021" height="2953" width="1920" />
        <Page index="8" size="1216900" height="2951" width="1920" />
        <Page index="9" size="1650500" height="2951" width="1920" />
        <Page index="10" size="2544723" height="2998" width="3900" />
        <Page index="11" size="2045030" height="2998" width="3900" />
        <Page index="12" size="1773291" height="2951" width="1920" />
        <Page index="13" size="1780221" height="2951" width="1920" />
        <Page index="14" size="1729622" height="2951" width="1920" />
        <Page index="15" size="1702175" height="2951" width="1920" />
        <Page index="16" size="1574702" height="2951" width="1920" />
        <Page index="17" size="1669914" height="2951" width="1920" />
        <Page index="18" size="1730573" height="2951" width="1920" />
        <Page index="19" size="1765073" height="2951" width="1920" />
        <Page index="20" size="2121982" height="2951" width="1920" />
        <Page index="21" size="1910822" height="2951" width="1920" />
        <Page index="22" size="1611487" height="2951" width="1920" />
        <Page index="23" size="1614281" height="2951" width="1920" />
        <Page index="24" size="2091726" height="2951" width="1920" />
        <Page index="25" size="1908541" height="2951" width="1920" />
        <Page index="26" size="1924791" height="2951" width="1920" />
        <Page index="27" size="1919434" height="2951" width="1920" />
        <Page index="28" size="1658495" height="2951" width="1920" />
        <Page index="29" size="1841634" height="2951" width="1920" />
        <Page index="30" size="1794905" height="2951" width="1920" />
        <Page index="31" size="1950178" height="2951" width="1920" />
        <Page index="32" size="1847993" height="2951" width="1920" />
        <Page index="33" size="3447741" height="2998" width="3900" />
        <Page index="34" size="1758921" height="2951" width="1920" />
        <Page index="35" size="1886432" height="2955" width="1920" />
    </Pages>
</MetronInfo>